Era,Start_Year,End_Year,Dominant_Team(s),Pennants_Won,WS_Titles_Won,Key_Trend,Most_Wins_Single_Season
Founding Era,1876,1892,Chicago White Stockings/Colts (6) + Boston Beaneaters (4),8,8,8-team league; no divisions; pennant = league title,"52 (1876 CHI)"
Dead Ball Era,1893,1919,Boston Beaneaters (9) + Pittsburgh Pirates (3),14,6,Record-setting wins; franchise migration begins,"116 (1906 CHC)"
Power Transition Era,1920,1950,NL Giants (5) + Boston / Cardinals (rise),6,5,Cardinals emerge; Great Depression & WWII impact,"106 (1942 STL)"
Relocation Era,1951,1969,NY Giants (5) + Dodgers (4),9,7,Underhand pitching era; expansion (1960s),"98 (1951 NYG)"
Expansion Era,1970,1993,Cincinnati Big Red Machine (4) + Cardinals (4),14,8,Divisions created (1969); LCS; first expansion champs,"108 (1975 CIN)"
Braves Dynasty,1994,2005,Atlanta Braves (14 straight division titles),5,3,Unprecedented division dominance; 1995/1996 pennants,"105 (2004 STL)"
Parity Cycle,2006,2016,Cardinals (3) + Giants (2) + Phillies (2) + Cubs (1),10,7,No team won consecutive NL pennants until 2016,"111 (2022 LAD)"
Dodgers Dynasty,2017,2025,Los Angeles Dodgers (8 straight NL West),5,4,NL record 111 wins (2022); perennial favorites,"111 (2022 LAD)"